{
 "schema_version": "1",
 "updated_at": "2026-10-28T06:16:54+08:00",
 "business_date": "2026-10-28",
 "last_run_id": "20261028T061540-40593406639.1",
 "last_run_complete": true,
 "last_complete_run_id": "20261028T061540-40593406639.1",
 "last_complete_at": "2026-10-28T06:16:54+08:00",
 "sources": [
  {
   "source_id": "all-daily",
   "status": "ok",
   "rows": 11,
   "error": null
  },
  {
   "source_id": "all-weekly",
   "status": "ok",
   "rows": 13,
   "error": null
  },
  {
   "source_id": "python-daily",
   "status": "ok",
   "rows": 15,
   "error": null
  },
  {
   "source_id": "python-weekly",
   "status": "ok",
   "rows": 12,
   "error": null
  },
  {
   "source_id": "typescript-daily",
   "status": "ok",
   "rows": 18,
   "error": null
  },
  {
   "source_id": "typescript-weekly",
   "status": "ok",
   "rows": 20,
   "error": null
  },
  {
   "source_id": "zh-daily",
   "status": "ok",
   "rows": 20,
   "error": null
  },
  {
   "source_id": "zh-weekly",
   "status": "ok",
   "rows": 22,
   "error": null
  },
  {
   "source_id": "new-30d",
   "status": "ok",
   "rows": 100,
   "error": null
  },
  {
   "source_id": "new-7d",
   "status": "ok",
   "rows": 100,
   "error": null
  }
 ],
 "counts": {
  "source_hits": 331,
  "observations": 171,
  "unresolved": 0,
  "tracking": 171
 },
 "api_usage": {
  "search": {
   "requests": 2,
   "limit": 30,
   "remaining_first": 29,
   "remaining_last": 28,
   "used_by_headers": 2
  },
  "core": {
   "requests": 171,
   "limit": 5000,
   "remaining_first": 4999,
   "remaining_last": 4829,
   "used_by_headers": 171
  }
 }
}
